{
  "id": "floor",
  "label": "Floor",
  "notes": "Generic walkable ground. Default friction delay 100.",
  "kindHints": ["tiles"],
  "catalogCategories": ["floor"],
  "render": {
    "scale": 1.0,
    "anchor": "middle_center",
    "variant": "icon"
  },
  "influence": {
    "friction": 100,
    "sight": 0,
    "flags": 0,
    "walkMode": "open",
    "sightMode": "clear"
  },
  "vertical": null
}
