{
  "id": "hole",
  "label": "Hole",
  "notes": "Hole / trapdoor down. Floor down is z+1. Stepping hops. HOLE | NO_CREATURE (8 | 64) = 72.",
  "kindHints": ["tiles"],
  "catalogCategories": ["special"],
  "render": {
    "scale": 1.0,
    "anchor": "middle_center",
    "variant": "icon"
  },
  "influence": {
    "friction": 100,
    "sight": 0,
    "flags": 72,
    "walkMode": "open",
    "sightMode": "clear"
  },
  "vertical": {
    "type": "hole",
    "deltaZ": 1,
    "defaultDir": "center",
    "bidirectional": false,
    "registerStairLink": true
  }
}
